NomClient,DateInscription,EmailContact,Region,Commentaire
Seguin S.A.,12/07/2022,danielveronique@salmon.fr,,Planche fleur tellement avancer mensonge toujours fixe étaler.
Lefèvre,21/09/2023,luciedelmas@barbe.org,,Etc ordre religion vol te glisser.
Grenier S.A.,29/12/2021,ymaury@gaudin.fr,,Réponse moindre rose divers secrétaire bleu mensonge.
Vincent Peltier SA,17/10/2022,eric45@seguin.fr,,Douceur oncle derrière fin endroit élément sourd.
Chartier S.A.S.,19/05/2024,renehumbert@marques.com,,Sombre chaîne passer compagnie voilà forêt sentiment.
Colas et Fils,18/02/2024,martinezalain@lebrun.com,,Autour peu connaissance égal tard.
Pineau,27/09/2023,thomas13@duhamel.com,,Travail juge garde apparence.
Dumont,06/12/2024,isaacrolland@bailly.fr,,Interrompre signifier musique pièce classe longtemps pas oublier.
Maillot Colas S.A.R.L.,07/06/2020,vboutin@nicolas.com,,Embrasser songer reculer écouter.
Mendès Blot SA,12/09/2023,fabreeleonore@martel.com,,Peur disparaître impression grand trente sérieux vision.
Guillon,18/03/2024,josettearnaud@lebon.com,,Comment tirer assez voix oeuvre avec chacun sommeil.
Moulin S.A.S.,23/08/2021,charrieradrienne@rousset.com,,Avouer chaque beaux secret.
Bodin S.A.S.,11/02/2023,arnaudeguillet@antoine.com,,Époque étonner rencontrer cas jour mentir.
Peron Mary SA,23/06/2021,maurice66@brunet.com,,But anglais comment intéresser.
Lefèvre,16/09/2021,vchauvet@laroche.fr,,Mode reprendre vide tour croire ouvrage pouvoir.
Weiss,09/08/2023,aimelegendre@grenier.fr,,Manquer consulter demeurer préférer.
Philippe,26/05/2021,guyoncharles@picard.net,,Valeur répéter foi côté offrir considérer transformer est.
Leroux Goncalves S.A.R.L.,09/03/2023,georgesmoulin@gimenez.fr,,Haïr répandre sérieux genre vif écraser renverser.
Richard Charles SARL,22/06/2021,hsanchez@lelievre.net,,Toute gauche posséder.
Martineau Noël SA,27/02/2025,gbenoit@dufour.com,,Moment barbe confiance forme.
Pruvost,11/11/2024,lejeunetheodore@delahaye.com,,Plaire caresser agent sac homme croire combien jambe.
Guibert,06/03/2022,thierrycouturier@nicolas.net,,Part suivre science âme.
Jourdan,03/10/2024,noemi02@henry.fr,,Deviner dépasser vendre en jusque arme désigner.
Roy Barre S.A.S.,07/03/2024,mmunoz@masse.com,,Accord saint revenir maître parmi eh.
Moreno,26/04/2025,kblanchard@barbe.net,,Profiter pluie épais seigneur.
Dumont,11/04/2021,mendeslouise@lenoir.com,,Fait absence couvrir votre devant.
Legrand Andre S.A.S.,06/07/2024,vincentlaurent@vincent.net,,Beauté voisin mentir brûler rare.
Jacques,05/06/2020,simone24@imbert.com,,Humide maître signe étrange centre attacher.
Lopes,09/10/2022,emmanuellevaillant@leroy.net,,Animal couche examiner eau chambre regard couler.
Thierry et Fils,10/11/2020,georgesmillet@lefevre.net,,Je certes derrière rond.
Lopes Gillet SARL,02/08/2021,henriettefernandes@lejeune.org,,Paysan sûr propos prononcer violence selon.
Joseph S.A.,15/12/2021,mathieumanon@fernandez.fr,,Article voie bureau désir.
Goncalves,26/05/2021,charlesgenevieve@antoine.com,,Quoi tandis que montrer article.
Dias,01/04/2021,eleonore42@payet.com,,Mois souffler arrêter couleur.
Pierre,19/07/2023,letelliermartine@salmon.net,,Mine enfin guère réussir différent visite dès seul.
Lacroix S.A.,29/03/2022,aimemarchand@weiss.com,,Espérer se effort haut vert geste mémoire plaindre.
Boucher Picard SARL,26/10/2022,bouvierjulie@lelievre.com,,Parvenir eau social ciel geste chant.
Brun,14/05/2021,torresalix@roux.fr,,Ferme interroger français certain.
Bernard,10/09/2023,dlopez@marie.com,,Obtenir poésie mentir race.
Baron Charles S.A.,07/03/2025,voisincapucine@marin.com,,Veiller encore voie mode signe séparer.
Le Gall S.A.R.L.,14/02/2021,ymuller@leroux.fr,,Charge offrir groupe remercier empêcher.
Maillard S.A.S.,10/10/2020,jnicolas@lagarde.fr,,Toile parole témoin arrivée anglais lèvre.
Pereira Morel SARL,06/07/2022,mfrancois@lefebvre.com,,Dangereux chemin souffrance bureau madame annoncer barbe.
Guillou S.A.R.L.,08/07/2020,rochemichelle@costa.com,,Même nommer grave hasard.
Blanchard,30/01/2021,wmorin@lefort.fr,,Supérieur cacher eau situation empêcher bande nécessaire ville.
Bernier,31/07/2022,delannoytheophile@paul.fr,,Monde résultat quoi leur exiger même.
Albert SARL,10/07/2022,charles28@raynaud.com,,Éviter plaisir vite bien arracher élément aider.
Delaunay Vallée et Fils,06/10/2024,benoitgerard@maillet.fr,,Dos promettre chemise.
Samson Dijoux S.A.,12/12/2024,rleroy@riviere.com,,Visible forêt sang pouvoir.
Perret,11/05/2024,elise61@laroche.net,,Entrer but soutenir tirer secours.
Brun Bertrand S.A.S.,08/05/2024,aimecousin@allard.com,,Plante mur cacher inquiéter cesse jouer pitié douter.
Delannoy,25/03/2022,boucherceline@baron.org,,Réfléchir fleur bas armer.
Neveu S.A.,23/04/2024,jolyemile@marty.com,,Silencieux neuf sentier près ligne soudain.
Rémy Gimenez S.A.R.L.,26/05/2022,nathaliealves@mercier.org,,Également frais si vision.
Pruvost S.A.,08/11/2020,claudine08@fleury.fr,,Inquiéter théâtre spectacle ainsi froid.
Diallo Boucher SARL,23/02/2023,mmartel@lagarde.fr,,Promener moins or grain.
Olivier S.A.,09/11/2020,pereirahenri@bodin.com,,Respecter craindre espérer calme.
Perrot SA,24/11/2023,alexcharpentier@peltier.fr,,Peau soit amener.
Bonneau,29/10/2024,perrotoceane@lemonnier.com,,Décider crise résistance rapport suite courant tracer.
Caron,19/09/2021,garniermarthe@laporte.net,,Souvenir souffrir décider âgé foule douze.
Le Goff,26/06/2021,anastasie79@fournier.com,,Satisfaire promener marchand point grain.
Charrier,08/09/2023,edouardmahe@thibault.fr,,Douleur troubler rapidement que.
Gaillard Blot S.A.,14/04/2025,boyersimone@dupont.fr,,Rentrer dormir gloire grandir doucement succès étage.
Besnard et Fils,18/12/2020,maggie03@raynaud.org,,Honte troisième espace disposer après bon principe continuer.
Perrot,09/02/2022,marthedurand@loiseau.fr,,Heureux lueur joli réponse étrange long expliquer.
Devaux,30/01/2023,gabriellepascal@valette.com,,Cent faute aile lettre lourd proposer.
Allard,14/10/2024,dos-santosanouk@julien.com,,Mer monde chant absolu un marchand.
Gaillard,20/06/2021,vincentperrin@gerard.com,,Près compagnon supposer cerveau séparer maître.
Cousin,19/08/2024,kseguin@pons.fr,,Fumée douter rang.
Besnard et Fils,30/08/2022,marechalsophie@robert.org,,Goût coucher précis naturel.
Picard,20/01/2024,maryselombard@blanchet.fr,,Chemise étudier compagnon matière paysan contenir examiner.
Mathieu S.A.,11/07/2023,mahejulie@da.com,,Cela corde enfin.
Vallet,21/10/2021,danielgregoire@levy.fr,,Ancien renoncer depuis somme maintenant emporter.
Tanguy et Fils,26/04/2025,marie85@lebrun.fr,,Résoudre voie aussi sable voix.
Morel SA,13/05/2023,georges22@michaud.org,,Revenir chef exemple intérieur nature.
Salmon,18/06/2021,timotheepichon@nguyen.com,,Demain marché malgré enfant défaut.
Daniel S.A.,07/04/2023,ucharles@gros.com,,Colline décider visite bas.
Bonnin S.A.,13/07/2020,helene99@fernandez.org,,Bonheur précieux classe discuter fois erreur arrière difficile.
Maillot,17/05/2024,cpierre@de.org,,Durer blanc confiance autre tellement.
Dupont Lambert SARL,19/02/2024,bonnetemmanuel@charpentier.com,,Défaut trésor ouvrage salle.
Pichon S.A.,26/12/2024,bodinandree@dumas.net,,Beau qui noir règle transformer.
Perret SARL,10/06/2020,rpereira@brunet.com,,Femme chose moins profond.
Thomas,09/07/2021,courtoismanon@pottier.com,,Besoin mal attention sembler aussitôt arme hiver.
Pasquier Labbé S.A.,18/10/2021,pferreira@herve.org,,Sommet dans défaut trente asseoir composer.
Chauveau,06/10/2023,aurore42@tessier.com,,Exiger retirer ramasser action cou un drôle.
Guillot S.A.R.L.,09/02/2021,nathaliepires@berthelot.net,,Sortir quelque commander soir.
Meunier Bailly SA,10/12/2024,aimeemahe@riou.fr,,Occuper brûler manquer continuer jeune découvrir raison.
Denis Hoarau SARL,25/06/2022,zbonnet@imbert.fr,,Facile vous objet rire.
Leleu,18/09/2024,sauvagenoemi@noel.com,,Question désir fête mille.
Costa Leclerc S.A.,08/07/2021,auguste02@rodriguez.net,,Pourtant est aujourd'hui froid fin crainte près.
Bonnet S.A.,26/06/2020,le-goffgregoire@roux.fr,,Naître présenter petit au danger travers.
Roussel,27/08/2020,camille03@pascal.fr,,Grand monter soulever foi pitié sembler centre.
Pelletier Bernard SA,17/06/2023,guillaumegimenez@roussel.net,,Marchand annoncer naître etc jour repas.
Bernier SARL,05/03/2024,de-oliveiravirginie@marchand.com,,Papier ruine leur prononcer pont.
Le Gall SARL,31/03/2025,smerle@clement.fr,,Épais demande leur figurer troisième.
Brun,13/01/2023,theodore82@georges.org,,Bataille émotion éviter au décider également.
Durand,24/09/2022,adupont@dias.net,,Poser servir deux feuille.
Charles,18/10/2024,remyarnaud@guerin.com,,Matin nuage matière comment froid suffire bouche général.
Grégoire S.A.,16/06/2024,nicolas66@lambert.com,,Secours source consentir pleurer mien.
Gonzalez,27/05/2020,zdevaux@lamy.com,,Reconnaître public façon habitude causer.
Turpin,21/10/2022,alexdelmas@olivier.fr,,Assez roman besoin mer servir.
Bodin,02/06/2022,guyaubry@pichon.com,,Sentir très confiance vague l'un lendemain combat franc.
Leblanc et Fils,06/08/2024,clemencemeyer@pelletier.com,,Odeur épais magnifique falloir impression connaître ça supérieur.
Pelletier S.A.S.,26/11/2021,marguerite50@renault.com,,Leur parcourir créer demander endroit sol tout.
Reynaud S.A.S.,13/07/2024,bonnetsylvie@boucher.fr,,Rapide regretter chef.
Étienne,10/08/2023,otessier@marty.com,,Particulier dimanche plutôt veille.
Deschamps,21/04/2024,martineauolivier@bourdon.net,,Jaune chez troisième nom vaincre.
Lemonnier,20/03/2025,tmuller@meyer.fr,,Endroit vide brusquement ensuite ainsi marquer président.
Moreau S.A.,09/01/2024,camillejacques@fleury.fr,,Tombe terrible habitude tôt tout.
Fournier,21/01/2021,jeanne07@maillard.fr,,Bas métier haute habiller.
Poulain Lemonnier S.A.,23/07/2024,kauger@ferreira.com,,Briller marquer devenir espérer comment.
Perret,24/02/2025,simone34@carpentier.fr,,Rocher froid d'abord ensuite huit joli.
Blanchard,10/03/2023,henryxavier@vidal.fr,,Corde santé printemps discours.
Barre S.A.,30/01/2025,bourdonemmanuelle@chartier.fr,,Bientôt presque nombre tirer parfaitement.
Barbier,21/01/2023,nicolas16@julien.com,,Folie voile apporter comme nombre demeurer énorme route.
Guillaume,06/02/2024,vidaldanielle@petitjean.fr,,Petit sorte affaire trésor commencement expérience.
Gaillard Dumont S.A.,28/12/2022,flopes@chauvet.org,,Billet sauvage bande monde cependant sens.
Olivier,03/07/2020,brigitte04@guyon.com,,Reculer sérieux cri social espoir affirmer.
Evrard Marchand et Fils,31/03/2023,marcelleleclercq@michaud.fr,,Chaud accompagner sourire vêtir corde.
Blanchard,02/07/2020,sabine62@besnard.net,,Vue de hier léger atteindre désert.
Payet Marin SARL,24/08/2020,julesrenault@ramos.fr,,Vrai payer souvenir bleu.
Blondel,30/08/2020,alphonseduhamel@delorme.net,,Aller recherche dégager soin tracer.
Gonzalez,20/03/2021,franckle-roux@fabre.fr,,Expliquer accent choix empire.
Leconte,10/10/2020,philippejulien@martins.fr,,Mot bon voler trouver.
Petit,04/01/2025,paulette63@humbert.fr,,Reste mot enfermer figurer.
Mallet Huet SA,11/04/2025,epereira@hoareau.com,,Long empire tenter moyen différent.
Valentin Raynaud SA,29/06/2021,bbouvier@bailly.fr,,Depuis entendre ordre reprendre attendre expression.
Leblanc et Fils,29/10/2022,claudine98@hoareau.com,,Vue somme entourer subir sein espérer.
Martins S.A.S.,10/03/2021,remycharles@delannoy.net,,Eh poitrine joie visage ordre brusquement cercle.
Fouquet,28/07/2022,julesguillot@briand.com,,Terminer fidèle carte songer.
Loiseau et Fils,18/02/2022,daniel41@didier.org,,Vivant quand conseil trésor mien ouvert.
Grégoire SARL,02/08/2022,gabrielferrand@mendes.org,,Usage faible tache parfois chasser action avant.
Guillet,25/02/2021,pageselisabeth@pelletier.fr,,Ainsi au tard.
Guichard S.A.,18/01/2021,thibautdos-santos@baron.net,,Effet beauté sauver âgé carte affaire.
Perrin,05/09/2020,wlambert@denis.com,,Allumer comment libre part table.
Mace,10/08/2022,carlierdavid@guillon.fr,,Rapporter rire autant problème.
Clerc,20/08/2021,noeldanielle@allain.com,,Parmi plaindre aucun chambre chant impossible.
Chrétien S.A.R.L.,13/06/2023,zjulien@gaudin.com,,Désigner inspirer présenter produire protéger rouge surprendre.
Turpin SARL,29/09/2020,margot01@ferrand.com,,Petit émotion inconnu beaux contraire absolument ceci appuyer.
Duval,27/06/2023,thibault79@dufour.fr,,Objet seulement officier apercevoir.
Michaud,31/01/2023,lucie94@navarro.fr,,Devoir double voir nombre drame état davantage.
Carlier,02/08/2020,odette25@morvan.com,,Espérer rose quand rapidement voici en but.
Bertrand,13/11/2020,ilouis@devaux.fr,,Paquet établir paysan libre volonté oh humide.
Pasquier,19/01/2024,monniernoemi@toussaint.com,,Sol droite passé oeuvre debout robe poids.
Teixeira,21/09/2022,marionrobert@dupuis.net,,Subir loin appartement fou résister ouvrir.
Buisson Hebert S.A.R.L.,28/06/2023,georgesgeorges@deschamps.com,,Servir recevoir cesser ramasser suite.
Moreau Traore SARL,11/03/2024,oblin@caron.fr,,Moyen somme établir véritable d'abord porte hasard accord.
Deschamps S.A.,23/08/2021,penelopeperon@schmitt.fr,,En respect bande bord santé valoir tâche.
Lévy,08/01/2023,aurore76@lemaire.fr,,Tâche déjà livre.
Costa,15/08/2024,ubonneau@arnaud.fr,,Journal souffler jouer.
Diaz,19/01/2022,lsanchez@lemonnier.fr,,Réclamer plaindre étoile mieux.
Grégoire SARL,29/05/2020,timotheelaroche@bouvet.net,,Autre essuyer me.
Boulanger,03/04/2023,anastasiebonneau@thomas.com,,Nation triste compagnie endormir après.
Martel,20/11/2024,garnierantoinette@peron.com,,Tard moins haute jeter monde.
Fleury S.A.R.L.,15/10/2024,ines72@lagarde.fr,,Froid croix écarter possible devant.
Bigot SA,23/01/2025,antoinettedelattre@rodriguez.fr,,Content sans portier causer mensonge vêtir mourir.
Mercier,16/12/2022,chantal52@tanguy.com,,Réponse écrire noire vue secret terme pensée.
Parent,13/08/2022,sseguin@de.org,,Lourd quoi ombre tu depuis.
Lebreton Morin SA,21/07/2022,theophile55@humbert.com,,Voisin pencher âgé étranger.
Marin SA,10/01/2023,antoinelaurent@leclerc.com,,Lieu pourtant savoir oncle attendre.
Aubert,25/08/2024,olivie35@brun.com,,Entendre lever coup.
Humbert,16/11/2020,chauveaulorraine@blanc.com,,Enfoncer voir boire ajouter groupe étude.
Maury,29/05/2023,amelie24@georges.com,,Blond simplement avance militaire.
Blin,11/07/2023,rlecomte@lecoq.fr,,Avant poésie lettre loi.
Dupré Philippe SA,10/11/2023,margauxpires@didier.fr,,Relever accorder de doux mort rencontrer.
Lenoir Buisson S.A.,16/04/2021,celinejoly@leconte.net,,Certainement tenter quarante finir.
Poirier S.A.,10/07/2023,jeannine56@pereira.org,,Perdre respect partager visite elle courir.
Bernier,09/09/2024,tmarion@richard.fr,,Chanter réel anglais tombe autorité.
Gomes Clément S.A.,09/10/2021,marechalalexandria@guyot.fr,,Événement suivre dessus porter quel combat froid.
Lacroix,07/05/2025,antoinettehardy@noel.net,,Joie au inquiéter.
Prévost,31/07/2020,qdevaux@pons.fr,,Croire franc éteindre durer commencer créer réserver.
Leleu,30/12/2024,huguesdelattre@benoit.com,,Paysan sec diriger agent point durer.
Richard S.A.,21/05/2020,rolandmarchand@mahe.fr,,Intelligence acte réserver.
Charles Perrin SARL,13/11/2024,vcamus@thomas.fr,,Usage rappeler rose famille mesure vague bientôt.
Leduc,05/09/2023,marine85@pereira.fr,,Âge rire former politique.
Grenier,12/12/2022,hdufour@pelletier.org,,Haut parler colère.
Sauvage Vaillant et Fils,21/12/2022,pde-sousa@ramos.com,,Trace mine personne déposer.
Andre S.A.S.,20/02/2023,ferreiramonique@le.com,,Immobile recueillir ombre retour.
Rodriguez Joseph S.A.R.L.,27/07/2024,yfernandes@diallo.com,,Passage accorder question précis.
Gilles S.A.,15/06/2022,cdiaz@charrier.com,,Armée poche couler dehors résister rôle volonté boire.
Lamy S.A.,29/06/2022,jfernandes@delaunay.org,,Devoir coup quarante intérieur position jardin eh.
Martineau S.A.,22/02/2022,josette61@carpentier.com,,Victime figure surtout neuf prouver accepter rouge.
Pierre Paris SA,21/12/2023,faivresusan@roche.fr,,Pointe remarquer endormir air dent terreur.
Bertrand Fernandes SA,15/06/2020,maryselucas@wagner.fr,,Salut dangereux revenir escalier souvent.
Da Costa,25/10/2021,fleuryandree@maurice.net,,Jeunesse mince elle distance compter.
Mercier,05/06/2023,jjoly@leroux.net,,Donner conseil rouler interroger sonner voilà commander inviter.
Hoareau Pineau et Fils,25/09/2021,lagardelucy@dijoux.fr,,Jambe lutte vrai trouver vivant soleil.
Blanchard,13/02/2025,andre87@baron.net,,Glace manier ennemi famille.
Poulain et Fils,29/03/2024,hoareauclaire@garnier.fr,,Guère précis dessus.
Masse,22/09/2020,nlefort@traore.com,,Salle manger comprendre partager.
Dufour Gaudin SARL,11/11/2023,kherve@vallee.net,,Manier autrement différent huit agir chant.
Delahaye,18/09/2022,vasseurphilippe@rey.net,,Matière condamner environ plaindre fruit coûter baisser sommet.
Sauvage Bouvier SA,28/07/2023,dupuisbenjamin@gregoire.com,,Rue gros un empire en du chance.
Mary,25/01/2022,colletarnaude@chauvin.fr,,Fier intéresser brûler simple longtemps terre religion.
Reynaud,14/03/2023,dbrunet@blondel.fr,,Mais courant protéger crise haut précis.
Normand Bousquet et Fils,12/02/2025,emilie71@lemonnier.fr,,Terrible amuser consentir pas paix.
Vallet S.A.S.,05/09/2020,mariannejoly@simon.fr,,Prévenir notre nul miser art.
Picard,27/03/2021,alfredcollin@leger.com,,Prince savoir te femme général guère sombre.
Guillou,01/09/2021,gmartins@allain.com,,Roman rapporter bas exprimer nouveau chat.
Guillot SA,26/04/2024,genevievebesnard@bruneau.fr,,Témoin dresser envelopper sens promettre droite.
Masson et Fils,03/06/2020,eda-silva@tanguy.com,,Comme fonction sorte également.
Hoareau SARL,23/08/2023,eric89@denis.com,,Déjà vert sourire horizon.
Raymond,08/05/2022,jacqueline82@legros.org,,Ensuite de lier haïr religion.
Tanguy SA,15/01/2021,martelvictor@lebreton.fr,,Retourner voir servir exprimer davantage loi chez falloir.
Denis,13/08/2020,antoinesalmon@barthelemy.fr,,Heure prier rang véritable.
Blot,17/05/2023,imerle@mace.fr,,Vol militaire secours étage.
Hebert S.A.,21/03/2022,uhoareau@hebert.net,,Soirée remonter craindre affaire principe nul vivre.
Lelièvre,03/11/2020,xsamson@gilles.net,,Aucun accorder intelligence partir pied taire quinze ignorer.
Laporte S.A.,31/07/2023,frederique55@allard.org,,Profiter sou fer passé.
Fontaine Foucher S.A.S.,08/06/2021,colettedelannoy@leclerc.com,,Vin renverser colon ferme asseoir saison habiller.
Lelièvre Gosselin et Fils,03/05/2024,ldelattre@thomas.net,,Souffrir environ naturel colère voile durer morceau.
Paul SARL,30/08/2023,mlebreton@renault.org,,Trois pleurer fille hier.
Arnaud Thibault et Fils,07/02/2022,delahayedominique@pierre.com,,Pierre veille foule rue autrefois spectacle.
Guillaume Blanchet et Fils,22/10/2020,josephperret@buisson.com,,Remplacer dix sérieux examiner sein.
Costa et Fils,06/09/2024,andrethibault@besnard.com,,Digne remplacer chaise ne prévenir posséder.
Maillard,14/06/2023,inesfernandez@bouvet.fr,,Aussi partir usage chercher élever marquer.
Lecomte,06/10/2021,jjoseph@lejeune.net,,Apparaître mais appuyer mesure.
Dupuis,30/05/2024,josettechauvin@de.com,,Ne également son recevoir.
Bailly Coste et Fils,18/03/2021,jerome59@marty.fr,,Comme présence on vieil.
Dufour,26/09/2021,grousseau@chevallier.com,,Sujet ouvrir vue hésiter soirée bouche professeur parent.
Olivier S.A.S.,27/08/2023,lucy09@regnier.org,,Plaisir mémoire personnage.
Guérin,02/12/2023,raymondbazin@perrot.com,,Appuyer gris sauter regarder appel bien.
Dupuy,28/01/2021,qmunoz@lebon.net,,Décrire chute agir.
Masson,02/08/2024,thierry03@paul.com,,Ne maître désormais humide fidèle fatigue.
Blanc SARL,15/02/2022,josettediallo@thibault.org,,Espèce brusquement après route peau.
Auger S.A.R.L.,30/06/2022,bertrandguillaume@carre.com,,Étranger nord menacer lèvre intérieur.
Barre,26/11/2024,delahayeamelie@bertin.com,,Type étouffer as dresser.
Martin,11/11/2022,fleuryfrederic@chauvet.com,,Est écraser plusieurs sur.
Roux,05/03/2021,ybonnin@paul.com,,Gens rejoindre même.
Adam,28/07/2024,theodorevincent@baudry.com,,Le d'abord confondre depuis animal approcher.
Ollivier Perrot SARL,24/11/2024,juliettelemaitre@martineau.com,,Cher combat mesure dessiner autorité mode quitter.
Jacob S.A.S.,17/05/2024,lebrunveronique@lebrun.fr,,Pareil sauvage journée nation désormais volonté répandre.
Robin,04/01/2021,veronique79@rodriguez.fr,,Doigt esprit tranquille public.
Coste,10/03/2024,elise51@dupont.com,,Longtemps étranger bord visite recevoir expression longtemps face.
Auger,20/06/2024,matthieubesnard@alexandre.com,,Volonté printemps reste remplacer règle conversation faveur.
Pons,11/01/2021,astrid71@gomes.com,,Sauver secret calme sien voici escalier.
Hoarau Auger S.A.,31/01/2023,julie34@collin.com,,Mal allumer prévoir jardin.
Blanchard,13/03/2024,ttraore@marechal.org,,Sorte brûler armée nature condition.
Leblanc,19/04/2024,clemence40@marques.com,,Visage remplacer commun lisser.
Duhamel S.A.S.,25/01/2023,mmathieu@perrin.com,,Calme loup considérer partager.
Germain SA,16/11/2024,xcarpentier@arnaud.org,,François dame user jouer semaine marier.
Rolland SA,11/11/2023,gimenezclaude@henry.com,,Muet bon figure semaine fixe nom briser.
Blot SARL,01/01/2022,edouardvasseur@jean.fr,,Désirer extraordinaire même loup valeur véritable éclater vin.
Dupré Lejeune SARL,08/05/2023,laurence27@charpentier.com,,Cesser promener frapper intérêt compter complètement complètement.
Perrot,24/09/2021,iduval@legros.fr,,Vue plein écouter branche avant.
Robin S.A.S.,20/05/2024,sylvierousset@voisin.com,,Écouter mieux pas couper vague inventer.
Lefèvre,13/06/2023,pierre57@cohen.fr,,Croix foule faux beau présence yeux sou.
Marchand,16/05/2021,pfouquet@pasquier.fr,,Faire naissance engager gauche cacher respect repousser prince.
Pruvost,17/03/2023,alexandria01@boulanger.fr,,Disposer écarter herbe.
Monnier Muller S.A.R.L.,27/08/2021,ribeirojulie@aubert.net,,Voyager assez fin contraire élever comment.
Colas SA,2022-09-08,nicolaslaunay@lagarde.org,Nord-Pas-de-Calais,
Joubert,2022-08-27,roypierre@gerard.net,Limousin,
Jourdan Ollivier S.A.,2024-07-24,margaret79@loiseau.fr,Saint-Barthélémy,
Pruvost,2023-11-05,simoneauger@fernandez.org,Saint-Martin,
Barbier,2024-08-26,lebonnathalie@vidal.fr,Basse-Normandie,
Raynaud,2022-07-08,blancvictor@fabre.org,Réunion,
Martineau Camus SA,2025-04-30,michelebarbier@albert.com,Centre,
Dias,2022-08-05,antoinette53@baron.com,Nouvelle-Calédonie,
Dos Santos SARL,2023-10-25,nathmasse@pinto.com,Pays-de-Loire,
Deschamps et Fils,2024-07-12,ruizamelie@munoz.fr,Pays-de-Loire,
Marques,2024-02-25,margaux46@auger.com,Wallis-et-Futuna,
Da Costa et Fils,2023-04-11,olivie39@chevallier.fr,Réunion,
Jean,2023-04-25,margaret58@renard.com,Limousin,
Andre SA,2022-08-17,antoinechauveau@raymond.com,Franche-Comté,
Teixeira Legrand S.A.,2022-06-07,qguerin@lopes.fr,Haute-Normandie,
Dupont,2025-05-08,mahemarcel@moreau.com,Corse,
Poirier Gilles SA,2024-09-29,denisehumbert@pages.com,Picardie,
Reynaud SARL,2024-01-20,fmarion@michaud.com,Limousin,
Maréchal,2024-10-22,bernard51@lenoir.fr,Champagne-Ardenne,
Maury S.A.R.L.,2024-07-19,barrealphonse@normand.com,Champagne-Ardenne,
Delmas SARL,2023-08-23,leonlelievre@benard.com,Centre,
Charrier SA,2025-02-17,jdupuis@leleu.fr,Languedoc-Roussillon,
Hardy et Fils,2024-09-09,margarettraore@delorme.com,Pays-de-Loire,
Moreno,2023-02-14,baillyjosette@roy.net,Nouvelle-Calédonie,
Nicolas Guillet S.A.,2023-01-24,inesgillet@delorme.org,Midi-Pyrénées,
Rocher,2022-12-26,josettesamson@lemoine.com,Rhone-Alpes,
Noël,2023-11-03,josephinemoulin@parent.com,Champagne-Ardenne,
Julien SA,2023-12-03,idos-santos@grenier.org,Martinique,
Mercier S.A.R.L.,2023-05-08,gilbertbouchet@cousin.com,Martinique,
Lenoir,2023-11-13,stephaniecharrier@michel.fr,Bretagne,
Pasquier,2022-08-17,bretonthomas@benard.fr,Nouvelle-Calédonie,
Lacombe,2022-08-30,antoinetimothee@weber.com,Guyane,
Coste Brunel et Fils,2024-07-08,augustin08@godard.fr,Auvergne,
Aubry Rémy S.A.S.,2022-09-05,rnormand@philippe.com,Wallis-et-Futuna,
Pichon,2025-01-01,louisemichaud@bonnet.com,Basse-Normandie,
Grondin Samson SARL,2024-12-29,francoiseguyot@costa.fr,Nord-Pas-de-Calais,
Paris,2024-04-22,valeriehoareau@mace.fr,Nord-Pas-de-Calais,
Bertrand,2025-03-17,jantoine@rocher.net,Aquitaine,
Leclerc,2022-07-24,frederiquegallet@pons.fr,Centre,
Dupuy Dupont et Fils,2023-11-20,lacroixjuliette@giraud.fr,Réunion,
Le Roux,2024-03-28,hamelmatthieu@guyot.net,Aquitaine,
Legrand,2022-11-23,gomezmarc@arnaud.com,Basse-Normandie,
Bazin,2025-03-04,richardlemoine@verdier.net,Province-Alpes-Côte d'Azur,
Lemonnier,2023-04-20,berthelotlaurent@fischer.fr,Province-Alpes-Côte d'Azur,
Vallée,2022-11-25,marineguyot@leclercq.com,Bretagne,
Marion,2024-10-16,olivielecomte@ruiz.com,Limousin,
Lemaire SARL,2022-10-31,antoine43@gallet.fr,Polynésie française,
Dufour S.A.R.L.,2023-08-18,aimee96@besson.fr,Midi-Pyrénées,
Perrier Peron SA,2022-09-17,henrylouis@gimenez.org,Languedoc-Roussillon,
Potier,2023-07-31,marcelnavarro@gosselin.com,Saint-Barthélémy,
Voisin,2023-10-18,renardvincent@boulanger.net,Midi-Pyrénées,
Renaud Hardy S.A.,2025-01-19,labbetristan@peltier.com,Guyane,
Hoarau,2023-09-12,costaantoinette@imbert.com,Nouvelle-Calédonie,
Pierre Bernier S.A.,2023-11-25,christine24@fabre.com,Martinique,
Hebert S.A.R.L.,2022-11-06,valentindavid@morin.fr,Aquitaine,
Le Gall,2024-12-18,chartieralfred@david.net,Corse,
Jean SA,2023-11-24,amelie68@berger.com,Haute-Normandie,
Guillou,2024-07-31,eleonore12@garnier.org,Province-Alpes-Côte d'Azur,
Coste Laporte S.A.S.,2022-06-07,fontaineantoinette@petit.fr,Auvergne,
Joubert De Sousa S.A.S.,2023-04-18,valerie00@maillard.fr,Saint-Martin,
Thomas,2022-08-02,guilletmargaud@marchal.com,Saint-Pierre-et-Miquelon,
Chevallier Marty S.A.R.L.,2022-11-12,swagner@bernard.com,Picardie,
Ribeiro Lemaître S.A.R.L.,2024-02-08,marchalmaggie@bousquet.fr,Nord-Pas-de-Calais,
