date_affectation,role,commentaire
2025-01-20,beckerpatricia@example.net,Chaise afin de salut aucun prince point arracher réduire.
2025-04-15,fleuryxavier@example.com,Nuage chien plonger joue fin morceau.
2023-07-17,colinelise@example.org,Sauter sommet nez creuser contenir discuter cuisine appel éclat.
2018-08-06,jjourdan@example.org,Rendre cuisine choix moi haut pourtant chaque dessus monsieur.
2023-05-06,le-goffjosephine@example.com,Haïr sec seuil prêter nuit premier profiter chef vague divers reste.
2024-10-21,edith31@example.com,Respecter secret dernier société apporter face quelqu'un rêver.
2016-06-11,tledoux@example.org,Loup général début fleur hasard retenir plus marquer.
2017-10-11,penelopebesnard@example.org,Ceci juste soumettre visage appartement rapidement mauvais nu chemise.
2022-04-13,victormartel@example.org,Inspirer heure maladie officier ou vers.
2016-01-25,lcourtois@example.org,Fumée consulter jamais sujet chambre voile paraître imposer.
2018-02-28,marcelle86@example.com,Rêve chaise briser préférer composer extraordinaire.
2022-10-27,ines47@example.net,Visage dresser retirer assurer habitant besoin détruire abattre et.
2017-10-25,olivier10@example.com,Long figurer relation détacher léger cabinet terminer changer paupière.
2024-08-03,qpages@example.com,Fidèle sérieux souhaiter consentir partout exemple vendre porter nation magnifique arrière.
2021-12-24,mahemaggie@example.com,Détacher longtemps quel discours faible retour compagnie payer.
2024-08-11,bbaudry@example.net,Sérieux violent paysage jeune drôle certain abandonner jaune perdu enlever.
2020-11-07,simone39@example.org,Révéler prévenir rejeter vieux arrivée tôt servir témoin signer magnifique rayon armée.
2024-05-19,ericmaillard@example.net,Esprit placer instant fruit demi entrée tu.
2020-01-14,jdidier@example.org,Espérer arrière particulier succès accord simplement reculer part crainte.
2017-09-16,mgautier@example.net,Arrivée repas fumer preuve descendre nom tranquille prêter madame.
2016-01-30,martine39@example.org,Détail clair patron précieux trésor tout reconnaître.
2020-11-18,kbesnard@example.com,Admettre acte d'autres figurer faveur jeune an vague facile précipiter.
2018-04-25,qbriand@example.com,Exposer question matière fort plaire soleil présence mine ruine premier nul établir.
2024-03-16,blancmargaud@example.com,Avouer peu exiger jeune envoyer l'une brusquement bas colon roman parfois.
2016-02-09,oreynaud@example.net,Place fine doucement jeune continuer devant.
2022-06-24,driviere@example.net,Pleurer détruire bien état embrasser social salut saisir fort étoile sauvage vieil.
2023-10-17,emercier@example.org,Mal très prendre personnage grâce couleur dent.
2017-05-22,vleger@example.net,Droite fonction tout recueillir sûr politique ceci bataille événement divers maladie.
2023-10-29,fernandezalain@example.org,Général enfant réalité même deviner métier remplir.
2022-01-06,antoine81@example.com,Voyage étendue entre chercher car absolument sortir sujet intéresser.
2023-05-21,virginiegodard@example.org,Parfaitement commun soir cependant système curiosité côté renverser sauter nom.
2018-06-18,ddelahaye@example.com,Machine un vérité intention bataille noir yeux jeu certain lendemain fatiguer portier ordre.
2019-10-23,audrey37@example.com,Réunir décider bruit fumer trop naître serrer diriger frapper volonté.
2015-11-18,marchandthomas@example.org,Bouche rond trou enfoncer unique larme heure suffire aspect.
2017-10-11,nguyennath@example.org,Trésor sac dégager chasser mêler dehors ville riche reconnaître agir toute.
2018-05-02,gilbertmarion@example.net,Garçon beaucoup faim résister particulier accord ton fortune science déjà combat.
2018-07-19,penelope50@example.net,Vaste partir scène considérer descendre herbe arme table construire.
2019-02-23,olivier97@example.org,Colère as voir surveiller bientôt révolution effet armée vide.
2017-10-09,brigitte07@example.net,Vêtement si oeil vérité condition trace pauvre.
2022-04-09,susanne80@example.net,Imposer effet tranquille vie religion soudain intérêt debout présent dire cerveau rouge vieux.
2017-12-28,victoirelefevre@example.net,Témoin lui juge espace accorder intérieur fruit oeuvre.
2021-03-18,gtorres@example.org,Répéter compagnon chute parvenir question journée fusil sac rapidement.
2019-05-08,bhernandez@example.com,Te avant jusque banc défaut autant bras avoir claire rare toujours inquiéter rose.
2015-11-08,gregoirehortense@example.net,Français discours entourer vieil bande bord trait plaindre rire préférer suite nombre.
2018-02-21,philippinemarty@example.com,Deux eh haut imposer que chute retirer.
2023-05-25,victorrousseau@example.org,Pas joindre humide brûler mal société préférer réponse.
2017-04-26,pereiramarie@example.net,Demain fait vide le espèce aller moi.
2016-03-14,zacharielaunay@example.com,Accuser remplir auprès corde pain salle fin système poitrine phrase naturel accrocher regretter.
2023-06-13,eguerin@example.org,Vingt pointe comment accrocher assurer résultat français gros nous malheur.
2016-06-16,adelaidelenoir@example.net,Où quatre forêt cinq droite suivant port.
2021-06-09,aimeecarlier@example.org,Tache oublier accorder trésor secours souvenir repousser note prière témoin faux volonté.
2021-03-29,christine60@example.org,Franchir travers rouge absolu grand pur rocher avancer.
2023-01-21,herveelise@example.org,Nommer oreille cheval lourd échapper perdu rose car respecter.
2018-02-18,barongerard@example.org,Éteindre bleu terminer cou entre dès souffler autrement recommencer fier.
2016-07-01,iduval@example.org,Soit prévoir signifier fatigue payer six.
2019-09-18,celine77@example.com,Départ aussitôt geste cause descendre île cuisine ouvrir dessiner ce parmi.
2024-04-15,jeannine12@example.org,Phrase rêve foule endormir beau propre voisin.
2022-03-07,bruneaumarcel@example.com,Lequel rejoindre leur rassurer nommer porter décider.
2022-03-01,fjacques@example.net,Comme mari somme devant mot oiseau allumer échapper rôle entrée delà plaindre aimer.
2025-04-02,isabelle16@example.com,Réserver casser marier me fusil envelopper système pitié.
2017-04-30,fhernandez@example.com,Regretter dire comprendre dont tempête transformer sûr peine.
2020-03-18,charlotte24@example.org,Témoin intelligence personne moyen passer rose.
2022-01-18,constance79@example.com,Afin De distance miser mon maintenant chiffre aider consulter.
2025-05-19,anoukjacob@example.com,Fois battre perte protéger fatiguer agent discussion tenter pleurer.
2018-01-12,rfischer@example.net,Vin désespoir chaîne supérieur passage anglais tuer long entre mari calme enfin.
2016-09-02,gerard67@example.com,Vêtir retenir changer parole pour demeurer.
2021-09-05,flouis@example.com,Chef obéir mort derrière prison haut.
2023-11-06,bouchetdiane@example.com,Partir lors présence centre vif satisfaire figurer.
2016-08-03,daniellelambert@example.com,Vers amener neuf décider trente bonheur.
2025-01-28,martine20@example.com,Sous sommet apprendre membre lisser caractère arracher flot.
2020-11-19,iboulay@example.com,Ouvrir mauvais scène étroit médecin aujourd'hui bas marier supérieur bon.
2016-05-23,xpelletier@example.net,Abattre seulement rien nord grand marquer.
2021-02-01,pasquierphilippe@example.net,Paix ou plonger ailleurs grain salut.
2016-01-22,dde-sousa@example.com,Rêver franc espoir intérieur plutôt sujet etc nouveau précieux embrasser simple nature.
2018-11-15,carolinemerle@example.net,Reste planche étage vieillard aucun genou.
2015-10-24,patricklouis@example.org,Somme chaud repas si trente préparer oeil porter résoudre qui.
2018-07-23,jeanguyon@example.org,Moment rue penser douter chiffre situation public.
2019-02-14,laurent16@example.com,Calme confiance moitié taille sortir recevoir aller moyen.
2018-08-26,turpinlucy@example.net,Mort y nom produire tache expliquer fer même.
2024-12-28,margot15@example.org,Intérieur coucher fête rocher si malgré faire.
2021-01-15,camusamelie@example.net,Air votre choisir mot ferme mémoire menacer membre.
2019-02-12,poiriernathalie@example.org,Oreille courage plaisir père conclure dimanche naître payer surveiller.
2018-03-19,cchauvin@example.net,Protéger animal aucun oeuvre chaleur beaucoup tendre mémoire rester dégager abattre que chiffre.
2017-06-19,julieroux@example.com,Situation indiquer intention inquiétude nation rôle éloigner.
2016-03-31,isaac48@example.org,Côte étage ni lier tombe grandir demi source épaule siècle fenêtre.
2022-07-09,patrickde-sousa@example.org,Ah content envie répandre établir savoir mesure partir mille brusquement élément barbe quelqu'un.
2019-05-07,martin03@example.org,Veiller cheveu endormir expression former travail lumière céder nourrir envoyer ministre un trois.
2025-04-27,constancedeschamps@example.org,Au effet miser genre tromper en étendre.
2022-10-29,mauriceguillot@example.com,Véritable bruit examiner pourquoi taille étoile réel acte puissance marier.
2023-05-04,obousquet@example.net,Tenir position inventer pénétrer sérieux moyen sauver brûler.
2018-07-01,collinantoine@example.org,Visage prendre coûter conscience taille donner trou.
2018-01-12,aliceguillot@example.net,Note empire maître amener espérer jusque asseoir accompagner terminer.
2021-06-17,ofischer@example.net,Fusil son contraire demain huit tuer idée aussitôt lever désespoir éloigner.
2018-10-25,briandmargaud@example.com,Salut calme vrai de note compter départ prétendre vers produire.
2025-02-11,leclercqzacharie@example.net,Jeter gris complet dessus mener descendre porte.
2017-05-17,georges65@example.net,Intelligence commun presque haute police aider promener.
2017-09-03,juliencarpentier@example.com,Voile d'autres discuter former garçon vin immobile subir ensemble mari peuple presque.
2020-08-31,oduhamel@example.com,Complet savoir train approcher sur coup violent juge lumière.
2023-06-15,fbernard@example.org,Mois mari partager réunir chaîne justice courant colère composer.
2022-03-18,mariannedelannoy@example.org,Ajouter trait vieux défaut nouveau valoir interrompre.
2023-07-08,idevaux@example.org,Été sou sur signe bien vaincre caractère armée note affirmer égal président.
2019-06-08,rcamus@example.com,Parcourir écrire relation fête accent tenir.
2020-03-23,kleinanouk@example.net,Eaux oreille non époque déposer sable rassurer répondre.
2023-12-17,marctexier@example.org,Résoudre circonstance intention trembler épaule aujourd'hui comment refuser celui descendre.
2018-09-14,couturieraimee@example.net,Combat peu chez visible chanter oncle lever.
2022-03-13,charlottebreton@example.org,Soudain prière vivre près toucher tout garçon.
2021-03-26,williamfournier@example.org,Comme paraître nul quarante compagnie emporter joindre personnage venir.
2018-09-18,margotthomas@example.org,Affaire diriger profiter bruit nourrir vingt habiter tempête groupe.
2022-10-09,alelievre@example.net,Bleu me approcher brusquement entre peine parvenir vert où inquiétude.
2022-02-28,aimeeklein@example.com,Bois discuter mettre plaire offrir chien lit tard époque assurer volonté douceur.
2017-07-09,perrinchristophe@example.net,Étonner déchirer nommer route amuser beau.
2018-07-01,madeleine73@example.net,Notre mort regard objet maître libre souvent.
2020-08-20,ilemaire@example.org,Morceau trace étage mort promener lisser cinquante conclure.
2019-11-18,chretienclemence@example.net,Approcher aimer traverser parti étranger construire pourquoi imposer pont réclamer.
2018-05-09,hugues03@example.net,Intérêt règle demain habiller âme quartier roman race inviter.
2022-05-11,francoisherve@example.net,Travail honte pas heure honte avenir attacher chaise abri partager goutte retrouver éteindre.
2021-11-11,juliettegonzalez@example.com,Femme joindre mer ministre seconde marquer sentiment.
2017-03-03,jacqueline82@example.net,Ah semblable sentier bord silence tellement apprendre mieux.
2024-06-05,reneebenoit@example.com,Riche accuser garder lueur vide montrer pluie exemple forme rejeter assez ami.
2016-03-12,ferrandsusanne@example.com,Est présenter puis sembler témoin droit y.
2015-07-21,zdupuy@example.com,Dire système user mort payer chien imaginer demande question partout charge penser épais.
2022-11-20,cgimenez@example.net,Accord deviner tourner accompagner comme cheval taire.
2021-03-25,sanchezandre@example.com,Supporter foule obéir brûler prouver voilà parti pouvoir donner personne spectacle.
2024-06-24,moniquelouis@example.org,Descendre exister empire depuis maître jeu simplement source.
2017-03-20,legendremanon@example.net,Nourrir toi trembler réveiller corde chasse ce échapper public.
2024-12-14,qclement@example.org,Façon ventre réduire où montrer émotion réfléchir unique tel droit satisfaire page voir.
2016-04-09,hgros@example.net,Entrée avis franc chemise feu trente ceci musique répéter naître.
2019-02-21,hweiss@example.net,Être aujourd'hui petit signe madame humain race environ savoir nuage trait comprendre.
2020-06-10,sabinefaivre@example.com,Doucement facile prévoir rue unique corde semblable emmener fortune flot présent.
2024-02-16,alfred42@example.com,Réel tendre sujet personne hauteur disposer interrompre commander âge taille problème fuir déjà.
2019-10-23,tcollin@example.org,Bas vif marchand avec déjà ailleurs commander.
2025-01-06,brunelolivie@example.org,Nuit séparer agent verser événement pied école cri.
2021-12-21,susanlebon@example.net,En ça quatre abattre exécuter retenir éteindre chez ouvert verser.
2019-04-30,hrossi@example.com,Chiffre noire proposer partout hiver nuit dame début aventure violence étranger sentier.
2022-01-20,mchauvin@example.net,Compagnie court étouffer quelque valeur autorité avant examiner muet vieillard.
2019-09-03,marcellebenoit@example.net,Mari sauter un grain consentir inutile sembler dieu.
2024-12-18,nathaliemarie@example.org,Proposer travailler ensuite petit animer précipiter or foi terreur social.
2017-05-12,stephane75@example.com,Remettre fort ne chance leur tellement.
2015-07-28,rogerdeschamps@example.net,Secret fête circonstance plein dernier tandis que éloigner gens rose mince émotion même paraître.
2019-08-31,atecher@example.net,Étouffer plaisir faible mort épais mon vieil.
2015-06-28,therese03@example.com,Entretenir chanter volonté espace désormais tromper verser.
2022-02-10,urousset@example.com,Vision porte même sans lorsque nuit étrange noire paraître inventer révolution.
2022-05-24,ogregoire@example.net,Empire vers donner craindre beaucoup diriger.
2022-06-06,techerthibault@example.com,Proposer sommeil prévenir drôle toujours toile unique fait.
2018-06-04,gregoireevrard@example.net,Page pont tard passage possible prêter serrer siècle énorme poste gros.
2022-01-07,martineauclaude@example.org,Essuyer embrasser assurer million jeunesse installer autre résistance plaire cesse servir annoncer dur.
2016-02-23,xavieralves@example.org,Jeune deviner poids ramasser officier malgré blanc chute environ fer ni.
2019-06-18,laurent03@example.org,Bas mieux classe guerre âgé loup tandis que renverser fumer exécuter autre.
2022-05-08,rturpin@example.org,An pensée gloire papier distance transformer esprit portier.
2024-01-01,michelelacroix@example.org,Après lier plus docteur rouge entrer sourd propre subir.
2024-01-06,patrick94@example.org,Complet pas fuir absence commander penser examiner au air apparaître serrer position.
2023-06-02,zvalette@example.net,Fois important empire chat remplir eau changer monde devoir.
2019-07-02,denise87@example.net,Plaisir arme cabinet quitter sombre étendue colon dos.
2020-04-27,wphilippe@example.org,Bout lisser épaule l'une choisir saisir bonheur quant à habitant.
2024-02-19,claudepoulain@example.org,Chien trop rapport intention choisir pur y.
2022-11-09,ylefebvre@example.net,Voilà accorder tout large huit neuf tenir preuve avenir.
2016-12-26,rolandlemoine@example.net,But glisser second devant compte pareil rare certain ne conduire.
2016-06-16,laurence98@example.com,Exécuter vrai madame midi main victime.
2018-06-18,clementlorraine@example.com,Haut nord sérieux diriger fatiguer voyager debout certainement menacer enfant épaule.
2019-01-09,margueritecollin@example.com,Sembler goût vers chasse me porte terreur pénétrer nuit douter emmener.
2016-05-23,fernandezmaurice@example.com,Écarter extraordinaire demande rompre été plusieurs vide marché briller arracher lourd.
2022-06-24,qperrin@example.com,Tantôt robe vin éternel nature ne.
2022-04-17,lucvaillant@example.com,Acte neuf aussitôt an découvrir rue lit rendre assister vol.
2018-04-12,elisearnaud@example.com,Lequel beauté autrefois hésiter marche accuser apporter résister sein tête.
2022-07-15,sauvageisabelle@example.org,Songer traiter dix content personne colon aspect bon nom important odeur signer rouler.
2022-01-08,amerle@example.org,Carte y seul et heure cheval vérité quelque.
2019-11-07,astrid93@example.net,Épais proposer nouveau fin roman attention.
2018-08-14,maggie49@example.org,Promener acheter facile chasse soldat subir triste attitude beauté mort construire exécuter prévenir.
2017-03-10,adumas@example.org,Faux rencontrer doux plonger conscience témoin tuer pousser imposer effacer cause.
2020-12-07,antoinegilles@example.com,Changement éprouver beaux bas demeurer remarquer.
2020-12-10,mathilde52@example.com,Traiter interrompre près cent paquet surveiller position signer début devant rôle sein mariage.
2018-05-11,editholivier@example.com,Simple public cas porter nation être.
2018-02-01,bertrandberger@example.net,Seuil être cheveu falloir demi reconnaître quelque intérieur lutte.
2022-09-17,margothuet@example.net,Acheter tout éclater mode angoisse éviter.
2018-08-12,marcel41@example.org,Avance haut papier bientôt étaler tout.
2020-11-09,kpeltier@example.net,Compter race vue espèce prêt auteur froid jamais poste discuter traîner tour mal.
2016-11-04,tessiermargaud@example.com,Sous plusieurs briser fois chair briser auteur.
2020-03-18,victor41@example.org,Papa même fin haut résultat amener garder marier divers.
2017-12-16,alixlaine@example.org,Fatigue condition vêtement que supérieur portier facile angoisse chaque existence blanc.
2023-06-24,stephanieroyer@example.org,Malgré cent éviter faute éclat train quarante refuser public.
2021-07-04,marchalnicolas@example.org,Soulever brûler promettre flot voir déposer espace terme.
2018-10-10,constance35@example.org,Souvent permettre jeune main vendre nuage plaisir peau.
2023-03-16,ncarlier@example.net,Service différent rouge froid foule fortune subir boire froid après achever maintenir risquer.
2022-12-26,michelegrondin@example.net,Genou devant objet poète jusque spectacle parmi.
2017-07-11,jdumont@example.org,Elle remercier représenter vérité échapper tendre quoi chef masse envie.
2024-10-02,emmanuelleferrand@example.net,Nul tout erreur moins point signe indiquer dangereux son.
2024-09-29,nicolas96@example.com,Témoin mener briller commencer ton quant à mesure compter.
2018-09-18,michel69@example.net,Cheveu connaissance succès dernier imposer résister leur franc époque.
2025-01-12,flopez@example.com,Tomber bonheur elle unique notre briser voix.
2016-10-14,loiseaujules@example.net,Aile or prouver bête puissance sentiment partie mari douze fermer.
2024-10-29,josephramos@example.org,Muet intelligence musique chat reste sac.
2019-12-15,davidsauvage@example.org,Rose sourire rassurer cacher connaissance engager soumettre prison naturel feu.
2020-03-03,margotjulien@example.com,Complètement dernier devoir briller empêcher perte tard tenir montagne quinze prince.
2021-03-22,anastasie55@example.net,Promener hiver fou réflexion inconnu plusieurs bas tirer dresser feuille rocher content changement.
2019-01-30,paulettesamson@example.net,Vivant vous appel plaire porte traverser bureau vers idée.
2019-11-11,pascalaurore@example.net,Lequel enfance côté situation ruine liberté meilleur détacher demain.
2021-05-01,froger@example.com,Surtout politique obliger circonstance politique tu.
2020-11-21,cleclerc@example.org,Secret il quoi désormais consentir mer.
2018-09-03,marie99@example.com,Posséder quart ramener dur rouler avance fidèle grand charger brûler gauche sauver engager.
2019-10-07,suzanne14@example.net,Parfaitement village terminer cercle agiter sourd semaine cheval dont tout terminer.
2019-05-14,jleveque@example.net,Clef coûter essayer rien calme en consulter tomber prière vague demander.
2020-01-07,flanglois@example.org,Point acheter dont salle confier bas profond combat.
2016-02-26,denislucy@example.com,Beauté traîner bon appartement réveiller retenir bout seul tantôt vite.
2022-07-17,eleonore69@example.org,Gros drôle rouge vision âme demande fruit avoir habiller.
2023-01-05,cgaudin@example.org,Précéder tout prison étoile traîner elle goutte saint centre.
2015-12-13,marinhenri@example.com,Coin soudain traverser direction disparaître argent descendre ensemble.
2017-12-25,adrienne32@example.com,Étroit assister complètement fil creuser cas système comment reprendre.
2024-08-22,francoiselenoir@example.net,Suivre enfance tranquille ah réserver croiser supérieur douter yeux indiquer.
2016-06-13,camillenavarro@example.com,Sept vol chaise avancer certain pendant sorte gauche naturel terre.
2022-02-09,vincentluce@example.com,Connaissance rire machine puis feu maintenant monde sujet fer tomber route.
2018-10-12,gabrielle84@example.org,Enfoncer général préférer bouche avancer cent prévoir comme secours avouer même désespoir seigneur.
2018-03-21,patriciabrun@example.net,Ignorer soumettre expérience écarter pays appartenir science différent naître frère.
2022-12-26,tfournier@example.org,Preuve marché précipiter huit figure pas argent satisfaire classe renverser existence.
2019-04-09,honore79@example.com,Sentier faute type naturellement parcourir essuyer abri air servir révolution égal pauvre à.
2017-06-18,zoefoucher@example.com,Pour qualité public vite puis commencement soulever réfléchir relation.
2018-11-05,susanleduc@example.com,Semaine arrêter genre autour juger affirmer affirmer.
2023-12-04,antoineanastasie@example.com,Transformer froid dominer armée inquiéter sou révéler taille glisser usage.
2023-10-28,nicole99@example.org,Comme précis effort moyen donc masse.
2021-01-16,georges77@example.org,Tranquille français ligne maintenir empire ruine armer maison ordre traiter général désormais expression.
2019-08-15,lecontemathilde@example.net,Pendre noir donner intérêt exemple précéder chaise campagne avoir.
2022-10-23,guy99@example.net,Demain que mine chien milieu rien bon.
2020-10-14,letellierlouis@example.net,Pauvre capable salut diriger dieu prochain exécuter réfléchir soumettre côte cou vérité offrir.
2020-02-09,laure25@example.org,Perdre anglais été colline accorder recueillir en fil moitié pourquoi dangereux.
2018-07-28,clementsebastien@example.org,Bien contraire établir taire nerveux longtemps saint point.
2016-01-10,brunelanastasie@example.com,Raison dix expérience croix devenir dessus caractère pur service sauvage ignorer souvent juger.
2022-10-12,isaac93@example.org,Amour gauche complet quartier approcher aimer besoin.
2017-01-23,bmahe@example.com,Vision votre songer cours déposer million énorme morceau forêt voir preuve prince ignorer.
2017-07-29,fleurymaggie@example.com,Salut vers savoir campagne manger promener agiter ceci militaire.
2025-05-14,cohendominique@example.com,Traiter y miser flot affaire lier.
2016-01-31,victorpoulain@example.com,Haïr fils couler fixer rentrer aucun apparence.
2022-12-28,luclacombe@example.org,Résultat article renverser route sauver corps.
2017-09-27,vmaillet@example.com,Seuil fleur beau miser grain autrement autre verre pouvoir poids.
2021-06-24,zpasquier@example.org,Centre événement étroit école donc page supérieur parcourir.
2021-05-30,veroniquebonneau@example.org,Secrétaire masse argent médecin exprimer oh.
2022-12-13,upasquier@example.net,Préférer rejeter course goutte suffire répéter perte sauvage d'autres jaune.
2017-11-03,cecileguilbert@example.org,Façon même discuter emmener maintenant enfance plonger adresser dessus court grave exister.
2023-05-18,arthur20@example.net,Colon parce que pierre raison étouffer rêver rêve ombre dessus plutôt retomber.
2024-04-06,rocherthierry@example.org,Ombre parti train intérieur oh chien mur trop supposer précieux noir intérieur exiger.
2017-08-20,nleclercq@example.com,Roche caractère preuve objet soirée marier figure million importance.
2018-10-04,barthelemyhugues@example.org,Toi reconnaître fenêtre premier fine marché rapide soit passé étonner annoncer nombre.
2021-02-11,tristanlemoine@example.com,Bien tromper parmi an année quand quarante.
2016-09-17,chantalandre@example.net,Toujours aucun résister réclamer où je eau cas sauver sol personnage conseil être.
2020-12-13,remyroy@example.net,Posséder témoin poste juge possible malade.
2021-08-20,fleveque@example.net,Tendre accent auprès parfaitement rose miser droite poésie visible marier silence.
2023-12-23,devauxcamille@example.net,Qui montagne malgré immense entretenir courant oublier état courir instinct.
2022-06-23,xavierpineau@example.net,Flot transformer étaler étranger soumettre double réunir lettre chasse.
2022-12-18,mgauthier@example.com,Juste beau situation chair partie aucun.
2025-01-31,christinecolas@example.com,Environ large avouer grain paysage présence rang pur terrain bas certain menacer.
2020-12-19,eleonore12@example.org,Pendre existence lit arme remonter peau source voile dormir.
2021-12-17,jerome39@example.com,Militaire sembler pluie glisser printemps roche fixer hésiter trait rouge direction.
2024-08-17,zdufour@example.org,Enfance exister il garçon travers rouge banc fermer.
