date_affectation,role,commentaire
2021-03-12,guillonvictor@example.com,Colline étroit chasse rôle machine traîner commencer poésie.
2020-06-12,julien87@example.net,Delà arrière recommencer hier permettre mettre étude feu envelopper chanter agiter embrasser assurer.
2023-07-05,etienne96@example.org,Tête petit voilà nécessaire position terreur papier chambre.
2022-05-25,albertmargot@example.com,Sous passion ça théâtre genre tendre changement dieu maladie.
2015-07-16,julienemilie@example.net,Politique haute plutôt remplacer puis voici bureau vouloir.
2023-04-13,ledouxvictor@example.com,Port dur apparaître dessus prince cent paupière.
2017-04-07,picardpierre@example.net,Caresser beau pendant apparence hasard rouge difficile voiture charger trois.
2021-06-14,alexandrie02@example.com,Consulter traverser hasard attirer parent supporter envoyer autrefois trésor entrer.
2023-04-23,vmonnier@example.net,Travailler expliquer jeter souvent quinze grandir nul.
2017-04-14,ycarlier@example.com,Rire mer rapide pouvoir ami triste âgé ventre.
2019-11-09,mauriceluc@example.com,Sentir jeu cas quoi fait tout cercle prison front fruit acheter avant nommer.
2022-09-15,astrid45@example.net,Poète robe couleur jeter succès histoire droit public drôle occuper mari.
2025-05-10,aimeepichon@example.net,Fleur attirer éclairer point achever image confondre figurer après former rencontre refuser.
2025-01-23,gabrielleguerin@example.com,Travailler sombre noir comprendre terreur nourrir devant.
2015-11-27,turpinanastasie@example.com,Poser juge rêve fin relever condamner un toute près impossible usage désigner discours.
2024-01-07,simonmargot@example.org,Regard pendant pousser secours docteur bataille dimanche plaindre quant à bête général arriver douleur.
2021-07-03,lambertstephanie@example.net,Enfoncer remonter facile chambre rose curiosité quatre eh rentrer banc calme.
2019-02-06,gonzalezvictoire@example.net,Chasser vide commencer as corde fond ville signe étrange moyen oreille matière charger.
2019-06-16,renaultvalentine@example.net,Fort service six coucher trait gris tantôt d'autres claire chance gagner confondre lueur.
2024-09-29,gaudinjean@example.com,Inventer mon campagne étaler fermer rouge curieux pays crier religion changer.
2021-08-19,therese20@example.com,Regretter rayon mon cour côté un égal mauvais résistance.
2016-05-18,lmoreau@example.com,Condition vie franc revoir déchirer ami ici rideau blond.
2015-09-28,gaycatherine@example.net,À rouge plonger comment séparer chacun devenir est père expression vieillard contraire interroger.
2022-05-29,suzanneregnier@example.com,Lentement frère sembler refuser plein joue parmi projet tandis que.
2016-12-05,collivier@example.net,Te cesser annoncer contre décrire capable avant placer ramasser.
2016-12-08,zacharie96@example.net,Confier lumière muet drame naître gloire double police retirer devant songer.
2023-09-03,llefevre@example.org,Cou différent roi construire saison construire inutile ou étonner écrire quelque son.
2020-09-27,ucohen@example.com,Bas frère lumière beaucoup gros être heureux étoile quelque vue besoin étouffer.
2023-08-19,proyer@example.net,Souffrir absolu vraiment désespoir supporter tandis que passer coeur rapidement.
2018-05-26,frederic02@example.com,Ennemi nerveux occuper santé quinze soulever tellement résister avance oublier mauvais.
2023-10-22,emmanuelle41@example.com,Consentir branche revoir vent courant absolument.
2015-10-21,marianneollivier@example.net,Trou parfois ouvrir nous compte maintenir saint justice livre qualité.
2024-09-28,alfredadam@example.net,Malgré jeunesse quelqu'un comme fruit ensemble droit prix user marché soit regretter fort.
2020-04-04,gabrielle21@example.net,Hésiter comment descendre fermer air différent plan éprouver.
2022-04-27,denise71@example.org,Dame visage contre coin observer nerveux fils remplir.
2021-08-21,bernardjoly@example.net,Alors extraordinaire tête tromper gens plaindre désir partager cheveu bien science venir expliquer.
2017-07-19,arthur20@example.org,Ou lui jardin dix croix interrompre poser malgré consulter.
2020-09-27,xpons@example.org,Revoir attention confier baisser chemise toujours pourtant ramasser grand.
2017-02-11,victoirebernier@example.org,Prononcer faute hier journal vers promener source son cependant tel donc protéger.
2021-12-13,monique43@example.com,Traîner remplir interrompre curieux rejeter plante fier mort trembler terre corde.
2018-12-10,maurice55@example.net,Lentement pitié très sourire lieu bas grand déposer conseil savoir.
2018-02-24,adriende-sousa@example.com,Vin essayer lever simple envoyer aucun preuve souhaiter maison éclairer joue.
2015-11-13,qpicard@example.net,Confondre d'autres salut repousser clair voisin classe tâche dès curieux unique.
2017-10-13,hhoarau@example.net,Toile agent flamme obéir voir rendre alors faim quartier sortir cheval droite.
2022-08-19,nlaurent@example.com,Voie résister patron mari joue ailleurs aider perdu reste.
2023-06-08,laurent31@example.org,Davantage lit an haïr maintenir relation vivant discours aider champ nombre rompre rouge.
2017-12-14,qrenault@example.org,Ailleurs appartement bien faible naître honte raconter aide.
2021-10-19,alexbrunel@example.net,Hier projet endormir apporter sable droit tendre campagne fixer haut colère pour paysan réfléchir.
2022-10-28,peltiercharlotte@example.com,Passé point rien nom charger mesure battre bruit entre ce nez réveiller.
2019-07-03,stephanie61@example.org,Aventure veiller politique apparaître dégager chaud sembler miser.
2025-01-08,jacquesmargot@example.net,Beau nuage fou éternel humide fauteuil rejeter elle deux nécessaire problème.
2025-03-17,dupuythibaut@example.org,Violent effort groupe midi étaler journée sauter falloir dernier intelligence fruit.
2018-01-22,hugues65@example.com,Neuf trente achever construire douze prochain million eau instant former apprendre battre mode.
2015-12-29,anne85@example.org,Profondément tôt arrêter instinct jeter armée retirer instant pas précieux habiter menacer voyage.
2022-05-08,diazmarie@example.com,Froid mesure danger porter fois demeurer choix neuf quatre soi sans étroit je.
2025-01-04,udelmas@example.org,Oublier ensemble prince complètement sept déclarer huit foi entendre supérieur envoyer place croiser.
2019-10-01,adijoux@example.org,Lutte prochain réclamer ce vide oeil champ goût compter.
2021-05-17,agnesramos@example.com,Obliger recommencer votre fusil prétendre tandis que plonger partout faible dresser voyager subir main droite.
2025-04-30,alfred60@example.net,Toi voisin fier route as renoncer lentement.
2022-08-29,vbourgeois@example.org,Prochain noir cours espoir flot naturellement durant signe partie autorité fermer.
2016-09-13,ccouturier@example.org,Précis intérieur travail mal à drôle chien agiter étranger.
2021-06-21,alex73@example.com,Siège aussi lutter chair consentir recueillir papier apprendre fait trente fermer soudain désespoir.
2018-03-16,operrin@example.com,Honte école journée que anglais dégager secret chien appuyer habiller événement santé oeuvre.
2020-01-07,pagesclaude@example.com,Plaisir haïr noir pont conseil haine tellement sur chanter.
2016-10-05,rboucher@example.net,Dix précis anglais preuve dessiner précéder intérieur pendant sous lien entourer mauvais offrir.
2016-07-27,gblondel@example.org,Voix françois hauteur hauteur départ quelque soleil table discussion cruel.
2015-12-04,chantalcouturier@example.net,Rapport général acte mode obéir couler gens traîner livre naissance garçon.
2018-05-27,marinesamson@example.net,Action côte soit chaleur campagne causer remplir dont moi chair professeur neuf mesure.
2017-07-28,arnaudeblanc@example.net,Ouvrage installer ensemble satisfaire mer relation avance briser élément.
2015-11-30,genevieve66@example.org,Après vrai dame séparer saisir larme livre vie demain nord.
2022-12-28,gilbert33@example.com,Disparaître sans siège anglais rare couper lentement.
2024-09-10,qlefebvre@example.com,Appartement égal humain sonner cruel plusieurs distance.
2018-07-02,jacquotmartine@example.com,Dame tôt ordre le causer vous nul.
2020-06-21,martyjacqueline@example.net,Mouvement dessus crise éviter trace cours riche content.
2015-06-08,reynaudmargaud@example.com,Croire paraître voisin tendre remettre désigner conclure ce mari.
2020-10-24,paulineklein@example.com,Transformer pleurer repousser précipiter garçon agir.
2019-05-24,elisevoisin@example.org,Aide traîner feuille saison mari ah rassurer dessiner ton roman.
2020-01-02,imarie@example.net,Cour rapide il espoir tracer espace armer front.
2022-05-18,leforttheodore@example.com,Envelopper dresser prier terminer roman finir voile eh entrée ensuite passion scène.
2021-05-30,lguillon@example.org,Douze trouver sueur français depuis mourir intelligence proposer.
2023-09-24,gerard00@example.org,As manger expliquer passé espèce traîner pencher noir cependant gloire poésie naissance.
2021-10-18,hroy@example.com,Épais prouver commencement demander ton histoire étranger encore.
2021-08-21,louisele-roux@example.com,Branche ennemi besoin barbe tenter envie poids.
2023-09-29,matthieuphilippe@example.net,Passé delà reposer ramasser me cacher début sein envoyer.
2024-11-25,julienrichard@example.net,Sombre grâce huit derrière gagner habitude.
2019-12-09,fpages@example.org,Glisser creuser papa paquet croire tomber bas visage.
2017-06-24,roussetmaryse@example.com,Lettre blanc vivre gros poste qui peine beaucoup charger reste inviter debout haine.
2016-12-06,broussel@example.org,Frère riche cependant hauteur visible aussi loi doigt malheur fatiguer accuser.
2023-07-06,guibertnathalie@example.net,Queue jamais connaissance fort seigneur docteur chose banc tout troisième appartement triste qualité.
2025-06-03,adupont@example.com,Cercle brusquement pièce ciel non choix saison.
2017-02-27,anastasie25@example.com,Commander charger rapporter papa le venir.
2017-04-02,vbuisson@example.net,Autre musique prix recevoir essuyer entourer préparer absence envelopper froid.
2016-01-12,ponslucie@example.org,Parcourir précieux lit genou idée fuir par.
2020-08-31,gilbert99@example.com,Apparence titre faute facile seigneur sac voiture.
2023-11-26,alexandrie28@example.org,Connaître voyager parole quitter poussière français image.
2017-10-23,laurentduval@example.net,Réel course quant à croire rideau victime arbre apercevoir considérer.
2016-07-03,susanne28@example.org,Soutenir distinguer accomplir dès simple clef penser rôle banc diriger cher.
2017-12-28,jacquethonore@example.com,Témoin capable troisième foule voie toi changer oncle couvrir.
2024-03-03,bernadette76@example.net,Soumettre courant recueillir absolu sur écrire chef.
2015-08-14,celine79@example.org,Certain étendue idée sorte soir moyen couper rang lier convenir.
2024-01-10,galletemmanuel@example.com,Espoir habiller simplement attention chemise peur marier expression.
2016-04-23,guerinemmanuel@example.net,Chasse devant folie naissance figure obliger extraordinaire personne art semblable terreur horizon lettre.
2017-09-26,schneidernathalie@example.net,Premier prix rompre apporter mêler capable rien service naturellement complètement.
2016-10-15,ygros@example.net,Blond oeil arbre déclarer retomber long chaque.
2021-11-09,lgregoire@example.org,Hôtel réponse agiter source armer révéler.
2017-01-13,barreantoine@example.org,Oh vivre trente attirer étranger entraîner trace.
2017-04-28,paulettecollet@example.org,Liberté de défaut saint robe être.
2016-12-18,tgilles@example.org,Fauteuil froid personne l'un année époque autrefois retour rencontrer.
2017-09-16,francoisebruneau@example.com,Large clef jardin question tapis précieux petit toile.
2024-11-08,xruiz@example.net,Voler interrompre calme minute toit demi claire liberté tard mer prière inutile.
2018-10-10,thibaut18@example.net,As ton repousser mois aussitôt chaleur depuis arrivée inutile faire.
2019-12-20,anne15@example.com,Drôle discuter changer perdu lueur respecter par rire sourire aimer désert un.
2017-04-11,luc93@example.org,Sortir deviner conversation mensonge travailler arriver rapide.
2016-05-14,adele08@example.com,Eaux signe mort nouveau forêt oreille entrer comment pont dessus défendre tandis que intelligence.
2018-04-13,nreynaud@example.net,Fixer or plaindre vie prix inutile.
2017-01-22,ydelahaye@example.com,Ne compagnon enfoncer lettre terrible visible seigneur énergie valoir action reprendre est second.
2023-07-05,alfred69@example.net,Accent geste trembler étage chaleur goût rapide cerveau ainsi direction.
2019-04-07,ivalette@example.net,Fonder inconnu vouloir avec rouler air espèce beauté emmener.
2016-02-06,rgarcia@example.com,Quel paysan glisser sombre recevoir élément route.
2017-07-31,luc28@example.net,Pluie pas joindre derrière rang sujet poste malgré direction entraîner.
2022-01-22,umerle@example.net,Prévoir autorité fou certainement tellement attention juger quart image lutte guerre.
2024-11-08,maryseaubert@example.org,Séparer aventure connaître lourd comment habitude neuf lien dehors part curiosité.
2017-04-20,bessonvirginie@example.org,Poste après ombre quant à voilà simple.
2015-10-01,paulinepottier@example.org,Beau société flamme nom mien prier plante.
2021-07-16,evrardstephane@example.com,Énorme chanter sac beauté étendre ignorer simplement déchirer pas arrêter.
2016-07-03,mathilde84@example.net,Vague presque embrasser mouvement grave père comment ministre page parti.
2017-05-13,vlebon@example.com,Assurer combat tempête toute pourquoi volonté apporter reprendre consulter.
2020-09-04,sylvie64@example.org,Parvenir deux émotion on emmener paraître on envie inquiéter paysan flot.
2015-12-20,oprevost@example.net,Clef rose reprendre second partager rose.
2015-10-02,adrienne58@example.org,Monde vif moment moitié présent apparaître présenter répondre.
2017-05-26,julesdias@example.net,Bataille robe honte froid été honneur minute ça vivant saison prix.
2016-06-16,meyerguillaume@example.net,Service escalier calme mine saint répondre.
2024-03-24,cohenrichard@example.com,Politique bas ni présent tellement promener passion.
2022-05-04,chauveautimothee@example.com,Professeur accord parvenir échapper expérience venir agent hors colline pas retomber ombre autrefois.
2021-06-08,delormedenis@example.net,Fin résultat devant créer dominer espace fête.
2022-06-14,rollandcatherine@example.org,Nuit semaine elle inventer froid sonner malade couche alors pour franc apporter discuter.
2016-02-07,dlaroche@example.org,Science enfermer tranquille obliger paquet guerre.
2021-10-08,benjamin92@example.org,Doute regarder payer supérieur air avoir réalité chasser.
2020-08-15,franck47@example.org,Bureau souvenir peur chacun descendre falloir oublier intérieur.
2022-10-10,ifrancois@example.org,Politique mieux discuter inquiétude condamner minute voilà nation presque.
2017-03-25,jacques09@example.net,Claire acte aspect grâce nourrir habiter façon troubler tapis.
2024-08-20,rbouchet@example.org,Aujourd'Hui satisfaire regarder usage million ailleurs écraser extraordinaire tellement vif tout composer.
2019-11-28,paulguyon@example.com,Vendre fixe mot conseil forêt éternel humain succès train suivre paraître aventure salut.
2021-01-20,colletadelaide@example.com,Matin affirmer éternel expérience petit produire mouvement loup près juste indiquer puis vêtir.
2023-04-20,henriettelombard@example.com,Froid oncle palais raconter herbe dernier réussir cheval sembler bataille.
2020-08-30,rribeiro@example.net,Accent si choix aventure doucement décrire poche distance dernier honte saisir découvrir croire.
2016-12-30,dle-gall@example.com,Français vite vite comprendre rester curiosité leur nommer.
2019-12-11,cdupont@example.net,Danser cinq intérieur prier nécessaire champ.
2024-06-30,michelle87@example.net,Naître taille partir vrai lèvre chute.
2024-02-19,susanduhamel@example.net,Vieillard course avant du exécuter âgé tourner homme cher fleur barbe habitant.
2022-11-03,thierrylaporte@example.com,Fils long se saint beau prévoir pouvoir instinct nécessaire même charge mieux effacer.
2023-05-21,emilie28@example.org,Immense sueur fusil dernier matin ramasser.
2015-06-26,samsonsophie@example.net,Résister fête étrange nouveau maladie port creuser demande.
2017-06-27,suzanne27@example.com,Paysan sans tard général pendre menacer.
2018-02-09,blejeune@example.org,Objet faveur auquel pas pleurer ajouter gagner.
2021-02-07,daniel87@example.net,Aucun puissant peu parfois attacher naturel tourner secret.
2018-08-21,odette35@example.com,Bas fer crier trembler temps assurer livre sonner son.
2020-02-05,marcbesnard@example.com,Porter noir occuper nu blanc accorder depuis.
2023-05-20,sabine88@example.org,Certainement aimer rouge habitude quinze recherche fenêtre.
2018-04-08,benoitherve@example.net,Comme prêt habitude trois oncle entrer doigt placer demain.
2016-09-26,laportestephanie@example.com,Peau page matière en il dominer reposer air planche rose.
2016-08-17,lalexandre@example.org,Étouffer rose croix police tracer chose.
2018-09-23,lda-costa@example.net,Surprendre autorité voir comme avenir préparer interroger intérêt discuter tellement volonté véritable poète.
2021-03-20,legrosetienne@example.com,Autant chemise ignorer soudain puissant payer présenter rassurer rideau lit flot tranquille.
2017-03-28,agnes90@example.net,Noir attacher triste rayon avancer ventre françois présenter voix.
2021-03-27,victorbouvet@example.net,Conscience air heure heureux lier ordre apparence mentir fin charge regard.
2023-06-15,guillourene@example.net,Cuisine l'une violence rencontre fin retrouver compagnie auquel riche esprit selon venir rideau.
2021-03-04,guerinluce@example.net,Apparence traiter tache éviter maintenant fond vivre médecin assister ça barbe ancien près.
2015-11-05,jacqueline10@example.com,Réfléchir sauver trouver échapper contraire voile rendre juge voici.
2018-09-15,ponssimone@example.org,Autre quitter depuis rentrer plaine aucun haïr place eau.
2018-04-27,thomas12@example.org,Anglais mince oh relation ci terminer droite.
2016-02-15,barthelemyfrancoise@example.com,Fou même chaîne désirer détacher armée choisir refuser figurer.
2016-03-15,reneecharles@example.net,Gloire ton travailler cent croire enfant accord avouer.
2017-06-05,gregnier@example.org,Mal droite contenir honneur étonner ancien observer tantôt aide objet étonner.
2020-07-17,hevrard@example.com,Mêler prévoir genre entretenir exiger inventer.
2024-09-28,bda-silva@example.org,Fusil supporter promettre monter doigt quel céder mensonge.
2023-06-26,zgiraud@example.org,Crier ainsi douze atteindre accord soir montrer dire intérêt anglais cuisine auquel sujet.
2023-05-30,charlotte27@example.org,Dimanche voir roche ciel votre maladie paquet habiller.
2018-10-22,jolysebastien@example.com,Social devenir rester matin préférer remercier profond toi.
2024-09-12,helenenguyen@example.org,Occuper finir mille ton séparer approcher simplement séparer prier.
2017-09-09,arnaudguy@example.com,Jeu prière question soulever ce animal parvenir billet construire colon tandis que.
2018-05-12,anoukgallet@example.com,Exemple autre paix reconnaître raison souvenir frère point cas prix chiffre.
2018-01-30,fcourtois@example.net,Longtemps geste parole politique étendre battre.
2016-05-24,josephinechevallier@example.net,Inutile fin métier recueillir point toit façon traiter chasse qualité voler haut prouver.
2020-03-04,andree55@example.org,Respirer écarter avoir signifier éclat posséder encore réel haut nommer clair attirer.
2024-01-11,dorothee05@example.net,Habitant te français effacer sonner premier charger apprendre quartier goût vivant profiter.
2024-02-20,bberger@example.net,Faveur étendre vite où accuser dangereux demande monsieur apporter mériter pierre patron.
2016-07-17,wcousin@example.org,Peuple douceur figurer détail quand faire mener santé.
2022-02-09,andreclemence@example.net,Pied champ magnifique désormais engager enfance discussion science.
2018-06-05,kthomas@example.org,Absolument décrire intelligence pauvre noir haut point vieux accepter un debout.
2021-01-14,leonrocher@example.org,Placer l'une bon non nul feu douceur demande un comme saint prix.
2023-03-14,lucie58@example.com,Retirer cerveau avancer choix chute couper fatigue écraser désirer or.
2018-05-25,aimee34@example.net,Protéger colon douleur résister élément réserver beaux donner bruit chiffre se.
2022-03-21,jeansabine@example.org,Entendre plonger faux propos million amour chef drame mur long militaire oeuvre rencontre.
2016-05-08,sebastienleduc@example.com,Et éteindre chasse impossible devoir détacher état près.
2017-07-05,patricia90@example.net,Cruel or pleurer donc déjà relever.
2020-06-15,julienemilie@example.org,Habiter votre pain y tout voix oh maître craindre.
2019-08-14,verdierodette@example.net,Mode rire perte croire ruine oublier lors projet valeur toile.
2021-09-03,ugermain@example.net,Gros hasard éviter danser rendre envoyer secret an valeur maladie départ mêler.
2016-05-16,danielle01@example.org,Assez sûr lune admettre regarder hiver regard.
2021-03-18,bonninlaetitia@example.net,Souhaiter il art preuve colon clair parcourir repousser cours maison eaux chose.
2022-07-01,morenoyves@example.net,Acte cuisine point sombre il tenter.
2017-11-03,ericguibert@example.net,Libre cas éloigner haut éclater pauvre chef coup beaucoup considérer françois.
2020-09-23,adelaideroux@example.com,Apporter écraser parvenir saint dessiner portier partir voyager tout.
2020-08-27,mpichon@example.net,Jeu caresser échapper vouloir seul fond race madame spectacle.
2016-04-05,annemorvan@example.com,Genre ajouter rêver froid souffrir tendre ensemble acheter étranger pendre.
2024-01-11,ulegrand@example.net,Immense que poursuivre contraire fusil professeur dos honte vent mensonge habiter espèce.
2023-04-19,tristan88@example.com,Amour inconnu mort nerveux absolu intérêt sauvage.
2017-01-16,laurentdavid@example.org,Alors aventure conscience important de soulever pas poussière surprendre tant.
2022-07-19,nalves@example.net,Remarquer face vif nouveau quel garçon parfaitement marier.
2020-11-10,lebrunolivier@example.org,Fermer transformer fête ruine dont désir ennemi.
2018-05-28,veronique53@example.com,Tache rompre pas histoire officier vieux ci.
2023-11-06,lucasmargot@example.net,Tourner rentrer hier je troubler de accuser.
2022-06-01,tessiervictor@example.net,Renoncer garder battre dormir admettre paquet calmer direction colon.
2019-07-29,gimenezeleonore@example.org,Résoudre seigneur mal retrouver étonner durer partie part.
2023-05-06,remycapucine@example.org,Scène couper plante bras ramener haine humain saint imaginer science prêt apercevoir fauteuil.
2023-08-12,carliermarcel@example.org,Attaquer plaisir consentir se papa tout dessus apparaître chez moyen dernier.
2022-06-12,christelleblin@example.org,Brusquement lorsque étudier chambre plante casser espoir occasion croiser million air grave le.
2015-09-25,christellepascal@example.org,Peu pourtant résultat étude trop nécessaire fer compagnie.
2017-08-08,luce87@example.org,Retomber coup travers éloigner dangereux déjà je oublier brûler.
2016-10-12,mguibert@example.org,Nuit bien peuple moyen rejeter roi mal.
2020-06-21,josephcaroline@example.net,Réduire grandir encore hors queue d'abord compter.
2024-12-05,pruvostsimone@example.net,Reculer feu témoin main habiller disparaître un colère million adresser autre donc marchand.
2019-02-03,alainpoulain@example.com,Pousser fort content ouvrir gauche violent petit réserver devoir calme entier banc seul.
2022-12-02,josettebouchet@example.net,Bord rompre ancien charger hasard chef jeunesse gros entre poser fleur rompre.
2016-02-19,marthe80@example.org,Traiter auquel réalité regarder grave étudier brusquement.
2019-05-12,hlebon@example.org,Cabinet ouvert simple erreur sol où accent rouge bien devant ignorer.
2020-05-14,jblanchet@example.org,Créer prochain reculer corde frapper souvent but réussir curiosité davantage vieux deux personne.
2019-09-17,roger42@example.org,Campagne fil pur rang chaise couler argent taille rire parent.
2018-09-19,veroniquedias@example.com,Présence mémoire rencontrer fleur monsieur principe titre le français pousser entre.
2023-06-26,cmasse@example.com,Face plonger colère absolu accorder relever rose exemple enfance.
2018-01-16,xmuller@example.net,Politique reconnaître portier travail oui intérêt.
2022-06-06,evrardlaetitia@example.net,Rouge baisser ville poste étendue vite endroit.
2018-12-07,rbaron@example.com,Espèce écouter bas heureux non causer honneur.
2022-02-12,francoise71@example.com,Rapide âme dépasser personne veiller énergie colon accomplir.
2021-04-22,costalaure@example.com,Séparer tu puissant midi parvenir rentrer.
2016-09-28,apicard@example.net,Ajouter quel réduire élément yeux vêtir poète fier lèvre ça.
2015-10-27,vdenis@example.com,Oiseau embrasser garde souhaiter passé grain.
2022-03-17,gregoire21@example.net,Phrase sol gagner écarter connaître vivre paupière.
2015-09-09,stephaniejoly@example.com,Demeurer souffrir construire aspect fine décrire.
2023-12-04,jean45@example.com,Lutter notre vieux trésor prendre camarade animer quelque soir dernier cesser.
2018-11-05,nathalie22@example.org,Tâche plante son rose voyager appartenir fort près.
2018-07-14,fredericleconte@example.com,Larme âgé dimanche cheval lèvre lever cent promettre fenêtre pas cri simple.
2020-08-17,delattrehelene@example.net,Social souhaiter autour mode papa chambre secret reconnaître herbe poste cependant écarter remonter.
2020-11-23,augustinbigot@example.org,Maladie preuve mêler consentir attention travail comme traîner toute semaine.
2019-04-22,william95@example.net,Cesser rassurer jeune installer feu étoile.
